[
  {
    "personal_info/type_of_registration": "S",
    "personal_info/gender": "F",
    "_bamboo_dataset_id": "",
    "health_information/waist_circumference": "30",
    "_xform_id_string": "aS8q5ondSN6xMVomPrwLpF",
    "meta/instanceID": "uuid:cfdfbff0-c6b5-4007-b20a-5f4794391ce9",
    "personal_info/last_name": "Hen",
    "end": "2019-03-26T11:40:05.888+08:00",
    "personal_info/first_name": "Houn",
    "identity_consent/town": "_",
    "identity_consent/organization": "TGF",
    "start": "2019-03-26T11:38:36.149+08:00",
    "identity_consent/country": "KHM",
    "_validation_status": {},
    "_version_": "vWd7VGyVkxnrLsXQvLFboK",
    "_status": "submitted_via_web",
    "__version__": "vEo56thCPymxS2RDBK2its",
    "personal_info/address_line_1": "Siam Reap",
    "_version__004": "voV2Fc6i2fZRrsqwx8tFTZ",
    "_uuid": "cfdfbff0-c6b5-4007-b20a-5f4794391ce9",
    "do_you_consent_AWH": "Y",
    "_tags": [],
    "_submitted_by": null,
    "personal_info/date_of_birth": "2019-03-27",
    "formhub/uuid": "cce709e26c584038a00cc6decb3b68ca",
    "health_information/height": "600",
    "identity_consent/region": "_",
    "_version__001": "vTrHL2APrGemfCrqWZ9CND",
    "_attachments": [],
    "health_information/weight": "60",
    "identity_consent/questions_to_be_asked": "MAM",
    "_submission_time": "2019-03-26T03:36:06",
    "_notes": [],
    "_geolocation": [
      null,
      null
    ],
    "identity_consent/personal_id_no": "99",
    "household/no_of_people_household": "2",
    "identity_consent/identity_document": "FBK",
    "identity_consent/cam_account": "soy_samol",
    "_id": 4296,
    "personal_info/civil_status": "SI"
  }
]